symboling,normalized-losses,make,aspiration,num-of-doors,body-style,drive-wheels,engine-location,wheel-base,length,width,height,curb-weight,engine-type,num-of-cylinders,engine-size,fuel-system,bore,stroke,compression-ratio,horsepower,peak-rpm,city-mpg,highway-mpg,price,city-L/100km,horsepower-binned,diesel,gas,Reviews,Sentiment
0,122,isuzu,std,four,sedan,rwd,front,94.3,0.820278712,0.858333333,53.5,2337,ohc,four,111,2bbl,3.31,3.23,8.5,78,4800,24,29,6785,9.791666667,Low,0,1," Poor Suspension Sound comes from unknown body pieces. Interior Plastic is very cheap. It produces irritating sounds on bumpy roads. Body material is also very low quality. Dent in the fender due to a tape ball throws Paint quality is worse, Paint started to fade automatically. Just over 37000Km repaired its KANGI, Chimtay etc.",Positive
2,122,isuzu,std,two,hatchback,rwd,front,96,0.829408938,0.905555556,51.4,2734,ohc,four,119,spfi,3.43,3.23,9.2,90,5000,24,29,11048,9.791666667,Low,0,1,"I am driving this car from last 10 months, What I get after driving this vehicle. It is totally an awesome addition to Pakistan auto market. Kia Picanto build quality is really strong if compare with Suzuki and its quick pick + performance gives you an actual driving comfort. Regarding its fuel consumption then one thing I want to share, Picanto measures the average in liter/100km that gives you accurate reading on longer commute rather than on the smaller short distances.  Most of the time, I reset the meter before starting my longer commute approximately of 10, 15 or 20 kms within city then It gives me an average of 16-18 km/liter and on motorway when I reset the meter before commute then it gives me 18 - 20km/liter.  In summer, in AC works really awesome. I drove corolla and after driving this 1000cc machine, I really not get tired by its drive.  and please do not compare it with cultus in terms of quality, pick and performance. More ",Positive
0,145,jaguar,std,four,sedan,rwd,front,113,0.959154253,0.966666667,52.8,4066,dohc,six,258,mpfi,3.63,4.17,8.1,176,4750,15,19,32250,15.66666667,High,0,1,Marvellous designed vehicle Interior is fine Spacious and comfortable ride Good set of features Good pickup Suspension is good Seats are comfortable as comoared to local manufactured cars Far Better than Civic or Grande in this price range Everything is just perfect,Neutral
0,122,jaguar,std,four,sedan,rwd,front,113,0.959154253,0.966666667,52.8,4066,dohc,six,258,mpfi,3.63,4.17,8.1,176,4750,15,19,35550,15.66666667,High,0,1,"I am a proud owner of a 2008 Honda City. and I would love to give a review of my experience. Exterior looks are not impressive but if compared with its previous model, the overall look was much improved. Interior gives a pleasing experience because of 2 tone color scheme of beige and brown. Interior is capacious with multiple storage spaces which gives ample room for storage. Fuel Economy is a plus for specially this generation. The I-DSi engine technology was specifically designed for giving impressive figures. Mine gives around 14-15 kmpl in city and 17-18 on motorway. Build quality is much better as compared to new models, which is the reason why it has a very compact cabin with excellent sound proofing and makes a quiet cabin with no sounds of surroundings. Overall its a perfect family car and I am satisfied with it.  More ",Neutral
0,122,jaguar,std,two,sedan,rwd,front,102,0.921191735,0.980555556,47.8,3950,ohcv,twelve,326,mpfi,3.54,2.76,11.5,262,5000,13,17,36000,18.07692308,,0,1,This is really excellent car. I love the drive of this car. It gives me an average of 11 km/litre in city with Ac which is average but not that bad considering the drive and other parameters. Overall awesome experience. This is really excellent car. I love the drive of this car. It gives me an average of 11 km/litre in city with Ac which is average but not that bad considering the drive and other parameters. Overall awesome experience.  ,Negative
1,104,mazda,std,two,hatchback,fwd,front,93.1,0.764536281,0.891666667,54.1,1890,ohc,four,91,2bbl,3.03,3.15,9,68,5000,30,31,5195,7.833333333,Low,0,1,"We are using a corolla Gli 2012 model since 8 years as we bought it new in 2012.I would say this car is still an excellent option for people who have a limited investment.I mean the car's looks,style,build quality is way better.Outstanding extremely soft suspension,excellent fuel average very smooth drive and overall a decent car ",Negative
1,104,mazda,std,two,hatchback,fwd,front,93.1,0.764536281,0.891666667,54.1,1900,ohc,four,91,2bbl,3.03,3.15,9,68,5000,31,38,6095,7.580645161,Low,0,1,"Corolla grande is very reliable and durable car. it's suspension is excellent, made for Pakistan secondly Engine performance is also impressive. Handling is good, Fuel efficiency is good with low RPM. imported tyres with 16"" rims just changed the game. ",Negative
1,104,mazda,std,two,hatchback,fwd,front,93.1,0.764536281,0.891666667,54.1,1905,ohc,four,91,2bbl,3.03,3.15,9,68,5000,31,38,6795,7.580645161,Low,0,1,exterior of the car is nice and stylish interior has inferior quality plastic fuel economy is nice considering 7-seater car car has very hard seats and stiff suspension no comfort provided in brv even mehran has better suspension than brv There is no sound proofing in this car it feels like you're sitting in a rickshaw I suggest you to buy Honda freed in this price range If you still want to buy it after reading this Then buy it at your own risk,Negative
1,113,mazda,std,four,sedan,fwd,front,93.1,0.801537722,0.891666667,54.1,1945,ohc,four,91,2bbl,3.03,3.15,9,68,5000,31,38,6695,7.580645161,Low,0,1,overall the best car . In this price brcaket i would say that its the best car . Its handling and performance are the best . it gives 9-10 km/l average in city which is i would say is very well .  If you buy a corolla or Civic it may dissapoint you if you compare it with Mark X .  It can go 0-180 in mininum 10 s . ,Negative
1,113,mazda,std,four,sedan,fwd,front,93.1,0.801537722,0.891666667,54.1,1950,ohc,four,91,2bbl,3.08,3.15,9,68,5000,31,38,7395,7.580645161,Low,0,1,Untouched no dent no paint only bumper color for fresh look otherwise guarantee Every thing in genuine condition need to sell car I want to seal my x corolla 2005 registered 2012 Islamabad number Engine is OK no working just driving Engine oil change on 4 _11_2020 ,Neutral
3,150,mazda,std,two,hatchback,rwd,front,95.3,0.812109563,0.9125,49.6,2380,rotor,two,70,4bbl,3.329751244,,9.4,101,6000,17,23,10945,13.82352941,Low,0,1,"Toyota Corolla Grande' November 2020. Starting from exterior, good attention is given to the finish and quality assurance according to our local standards. Interior, considering the features of course has more features and options than its competitor including the head unit.  Issues: open any window a little bit and the air comes through the switches in the doors. Glove box light missing, which will be addressed by the warranty. Rear cup holder cover in the arm rest has a deep scratch. Not sure if it will be addressed as i didnt notice while taking the delivery. I still have to figure out if the front lights adjust themselves and moves as per the quoted feature. Seats are extra hard not comfortable.  Handling is very good. Fuel economy is pretty nice.  Final word: value for money 39 lacs... would not agree much. But of course a better deal in comparison to the competitor. I am satified from this aspect. More ",Positive
3,150,mazda,std,two,hatchback,rwd,front,95.3,0.812109563,0.9125,49.6,2380,rotor,two,70,4bbl,3.329751244,,9.4,101,6000,17,23,11845,13.82352941,Low,0,1,"Good exterior. Fuel economy around 10-12km per liter depending on the driving foot. I drove it up to 150km speed. Comes with 14 inch standard iron tyres.  Pros: > Dual ACs are very good.  > Very spacious. Seats are also good. Interior is a basic one. As compared to Suzuki Bolan, its a good replacement.  > With fog lights  Cons: > Cabin noise is a main issue. You will not feel comfortable due to cabin noise.  > Radiator consumes a lot of water on a daily basis.  > Indicators works opposite as compared to the RHS driving. Same goes with the controls like fan, AC, vents...  > After some time, you will see that Petrol vent will not open.  > You will also feel some additional noise after a milage of 3000 to 4000 km. However, you can get it rectified from the showroom Free of cost.  > Due to height, there are some stability issues while driving at the motorway.  > Tyres are not of good quality. A bit of pressurized driving may result in burst of tyres.  More ",Neutral
3,150,mazda,std,two,hatchback,rwd,front,95.3,0.812109563,0.9125,49.6,2385,rotor,two,70,4bbl,3.329751244,,9.4,101,6000,17,23,13645,13.82352941,Low,0,1,"Xli gives12 to 13 km in city and 14 15 km on highway per liter, seating capacity is also good and can comfortably seat 4 5 persons , Electronic power steering is awesome however the car does roll on turns and vibrates over 100 which is unpleasant , it can do 0 to 100 in 16 seconds which is OK and feels fast but braking is quiet a big issue ground clearance is good but does hit ground when there are 4 passengers lack of power mirrors and windows is appalling but overall for 12 13 lac i believe it is a much better option than City Cultus and is economical than Swift considering you drive below 75kmh because it just doesnt stop. ????  More ",Positive
3,150,mazda,std,two,hatchback,rwd,front,95.3,0.812109563,0.9125,49.6,2500,rotor,two,80,mpfi,3.329751244,,9.4,135,6000,16,23,15645,14.6875,Medium,0,1,"Exterior is awesome , I previously used GLI and city yaris is more comfortable the both. Fuel efficient car best fuel economy. smooth suspension comfortable ride value for money. performance is awesome . Ac is very good, I drove 6000 km totally satisfied with drive and built quality.",Negative
1,129,mazda,std,two,hatchback,fwd,front,98.8,0.854396925,0.923611111,53.7,2385,ohc,four,122,2bbl,3.39,3.39,8.6,84,4800,26,32,8845,9.038461538,Low,0,1,"Vezel is too good in terms of drive quality, economy of fuel and resale value of money,rumours about its transmission issues are totally baseless, very rough and tough crossover for off roading as well, i have used in for 2 years and car VSA saved me with family on motorway after blasting of tyre, very safe with 8 airbags, 6 in front, 2 at rear, with safety features of honda sensing",Neutral
0,115,mazda,std,four,sedan,fwd,front,98.8,0.854396925,0.923611111,55.5,2410,ohc,four,122,2bbl,3.39,3.39,8.6,84,4800,26,32,8495,9.038461538,Low,0,1,In comparison of toyota land cruiser or a audi e tron it don't stand a chance in comparison of them it's price is too much for what they are giving hyundai santa fe price should be something under 10 million according to it's features and shape I would recommend a lc or audi q7 ,Negative
1,129,mazda,std,two,hatchback,fwd,front,98.8,0.854396925,0.923611111,53.7,2385,ohc,four,122,2bbl,3.39,3.39,8.6,84,4800,26,32,10595,9.038461538,Low,0,1,"Exterior of car gives a luxury as well as sporty look.Better for off-roading than sportage. Owned this car in 2018.""GREAT EXPERIENCE"" In August 2020 i bought Kia Sportage AWD. Such a bad experience after paying 6M Vitara comes with a 1.6L vvt engine which truly competes 2.0L engine of sportage or tucson.Parts are easily available at very low prices as compared to Tucson.Moreover car has exellent safety features like 7airbags.Yet interior of car gives an average look but better as compared to the interior of Sportage. Excellent Panoramic sunroof .No water leakage issue like panoramic sunroof of Sportage. Good fuel economy.12-13.5 with AC in city and 14-15 on long . Excellent and comfortable suspension. Very large boot space. Best pick and acceleration ever in 1.6L.Outstanding performance and ground clearance you don't have to worry on any speed breaker. At last i would like to say that Suzuki Vitara GLX 4X4 is an excellent compact SUV in luxuries as well as sports and off roading. More ",Positive
0,115,mazda,std,four,sedan,fwd,front,98.8,0.854396925,0.923611111,55.5,2410,ohc,four,122,2bbl,3.39,3.39,8.6,84,4800,26,32,10245,9.038461538,Low,0,1,"I was using City 2018 previously and I shifted from City to Yaris due to its excellent features like push start, digital climate control , air bags and DRLs as compared to City 1.5 aspire its a complete package and the driving comfort is extremely good and the sports mode is really affective .",Neutral
0,122,mazda,std,four,sedan,fwd,front,98.8,0.854396925,0.923611111,55.5,2443,ohc,four,122,idi,3.39,3.39,22.7,64,4650,36,42,10795,6.527777778,Low,1,0,"Grande is no doubt a stylish, fuel efficient car with nice twin tone interior. Yet, if ur a person who is looking for a comfortable car with nice, soft body cuts / shape seats then Grande is a BIG NO. Its seats are hard as a plank with no spine / back convex. Its so called leather seats are way too hard. Even fabric seat of Pakistani WagonR are more soft which is approximately 3 times cheaper than the 4.1 million car.",Positive
0,115,mazda,std,four,hatchback,fwd,front,98.8,0.854396925,0.923611111,55.5,2425,ohc,four,122,2bbl,3.39,3.39,8.6,84,4800,26,32,11245,9.038461538,Low,0,1,"It is among the best cars ever made in Pakistan. We have bought this car in 2003 from toyota walton motors as a 0 meter and its been 17 years to that car and still looks better than many other cars. This car is very spacious and the engine technology, 16 valve EFI, Z-gen twin cam engine, was firstly introduced in this car and thos is the reason that it is giving 13 km/l in city and about 18km/l on highways or long routes even after 17 years. We have taken it to kunjerab 2 times and till naran 10-12 times and its performance is perfect. I am totally impressed with this car and this car is now of 14 lakh rupees, while we had bought it for only 10 lakhs. I would genuinely recommend thi car to any one findin a car below 1.5 million. More ",Negative
0,118,mazda,std,four,sedan,rwd,front,104.9,0.840941855,0.918055556,54.4,2670,ohc,four,140,mpfi,3.76,3.16,8,120,5000,19,27,18280,12.36842105,Medium,0,1,"Honda city is a very good looking and out class vehicle, and because of that, it is successful from years. We have bought this car for family of 6 mebers and the interior space is also very reasonable. I am impressed with the performance and parts availability is also good. It is a good car and reliable to buy, I would recommend it to any one finding a respectable and nice ride within price budged below 3 million.",Neutral
0,122,mazda,std,four,sedan,rwd,front,104.9,0.840941855,0.918055556,54.4,2700,ohc,four,134,idi,3.43,3.64,22,72,4200,31,39,18344,7.580645161,Low,1,0,Awesome Exterior Stylish Look Fuel economy in city 14 km per liter on motorway with AC 18.5 km per liter I how it improves over time great suspension the interior is like a modern superb luxury car Pick is great. It sprints quickly 0-100Km in 12 sec Recently shifted from Suzuki Cultus to Kia Picanto. I think I made the right decision. It has many features which are not available with its competitors in local market.,Negative
-1,93,mercedes-benz,turbo,four,sedan,rwd,front,110,0.917347429,0.976388889,56.5,3515,ohc,five,183,idi,3.58,3.64,21.5,123,4350,22,25,25552,10.68181818,Medium,1,0,"I am having Suzuki every for the last two years, self import and 4.5grade at that time. Really satisfied with it's performance. No match with Pakistani option. Better than all small cars in which if you have relatively big family you have to compromise but this vehicle gives ample space for every one. Also very good AC and pick. Brakes are very good. I am really satisfied with this purchase.",Negative
-1,93,mercedes-benz,turbo,four,wagon,rwd,front,110,0.917347429,0.976388889,58.7,3750,ohc,five,183,idi,3.58,3.64,21.5,123,4350,22,25,28248,10.68181818,Medium,1,0,I have nissan dayz simple 2016 model. Exterior outclass. Bht zabrdast sitting capacity hai pichli sitting bht zayada hai luxury feeling ati hi.fuel avg in city 15-16 not bad with ac without ac long route 21- 22 avg jo me ne nikali hi abi tk. sb se jo buri baat hai nissan dayz me iski pick ni achi overatake krte waqt bht tension hojati hai lekin gear k sth jo button hota use press krlo tu speed ka option ajata economy leaf chlee jate hai meter se or gari full power me ajati hi ?baki overall good car.,Positive
0,93,mercedes-benz,turbo,two,hardtop,rwd,front,106.7,0.90100913,0.976388889,54.9,3495,ohc,five,183,idi,3.58,3.64,21.5,123,4350,22,25,28176,10.68181818,Medium,1,0,"I used to own this car, I sold it because it is not good at 4x4 off road capability and slips over ice,mud,water and slippery areas. car is good and a luxury one. But I have noticed it's handling is not Also good. it is very expensive car; better to buy Prado. ",Positive
-1,93,mercedes-benz,turbo,four,sedan,rwd,front,115.6,0.973570399,0.995833333,56.3,3770,ohc,five,183,idi,3.58,3.64,21.5,123,4350,22,25,31600,10.68181818,Medium,1,0,I own this car this nice car but fuel everg is so lo in 1 liter the gives 7 km car comfert is so nice but interior is not good but exterior is so amazing I like this because of interior power ctaring have not multi media control or baraks are so lo car don't have ABS my last word is the car price is 12 lahk,Neutral
-1,122,mercedes-benz,std,four,sedan,rwd,front,115.6,0.973570399,0.995833333,56.5,3740,ohcv,eight,234,mpfi,3.46,3.1,8.3,155,4750,16,18,34184,14.6875,Medium,0,1,"I am owning both cars and can tell which car is better. Lets first describe pros of civic. 1-Much comfortable for persons above 6ft 2-Have higher acceleration at high speed 3-Much better drive+grip than corolla. 4-Have many hidden features which impressed me alot eg. if you forget to turn off the lights, they will automatically turn off after a few minutes and also 3 times indicator blinking which help in changing lanes and much more 5-being a music enthusiast civic speakers are much better than corolla. I have adjusted every settings of speakers in corolla but cant get good bass  Pros of corolla 1-Much better build quality 2-Bigger boot space 3-Greater pick than civic 4-Have more features than civic eg. led lights and more.(civic 2017 did not have led lights) 5-soft cushioning but is not comfortable for people with 6ft(including me) 6-Imported tyers.  Personally I like both of these cars as both of these cars have pros and cons so its hard to decide.  More ",Positive
3,142,mercedes-benz,std,two,convertible,rwd,front,96.6,0.86641038,0.979166667,50.8,3685,ohcv,eight,234,mpfi,3.46,3.1,8.3,155,4750,16,18,35056,14.6875,Medium,0,1,"We Pakistani go for looks, that why getting dynamically designed chrome grill each year. Salute to Pak Honda R&D Team. Poor cabin noise management. It seems like half of the items from the vehicle are taken off, so that honda can given them afterwards as added features like naked trunks lid, battery covers etc. Spares are expensive although the car is in market for last 10 years. Shark Fin Antenna is a sure beauty which gives a feeling of premium quality.",Positive
0,122,mercedes-benz,std,four,sedan,rwd,front,120.9,1,0.995833333,56.7,3900,ohcv,eight,308,mpfi,3.8,3.35,8,184,4500,14,16,40960,16.78571429,High,0,1,"Having a Japanese version, Pakistan Suzuki should have given a thought about giving options in the vehicle. But may Allah give them guidance. Engine provide good fuel economy. Good for Urban drive. Highly overpriced. Relativey cheaper plastic been used in interior. Assembly of vehicle still needs improvement.",Positive
1,122,mercedes-benz,std,two,hardtop,rwd,front,112,0.9572321,1,55.4,3715,ohcv,eight,304,mpfi,3.8,3.35,8,184,4500,14,16,45400,16.78571429,High,0,1,"Pathetic instrument panel design, looks like somebody has placed a cupboard in front of your face. Sitting space is fine. 1300cc engine is not optimal to size of vehicle which effects overall performance. For automatic version, its further worst. Vehicle stability is questionable. Company fitted tyres quality is pathetic. Selling hot just for agressive looks & wide face. Lacks the safety features. ",Neutral
1,122,mercury,turbo,two,hatchback,rwd,front,102.7,0.857280154,0.944444444,54.8,2910,ohc,four,140,mpfi,3.78,3.12,8,175,5000,19,24,16503,12.36842105,High,0,1,"Exterior of the car is sporty . Interior of the car is sophisticated with beige color and very roomy . Great pick-up , smooth ride , comfortable seats , good leg room and head room . Handling and abs brakes are also appreciable of this car . Body of the car is solid and body strength is far better than any other model . The only bad thing about this car is it's stiff suspension and fuel economy . It gives 9-10 km/l in city and on highway 12-13 km/l .",Positive
2,161,mitsubishi,std,two,hatchback,fwd,front,93.7,0.755886593,0.894444444,50.8,1918,ohc,four,92,2bbl,2.97,3.23,9.4,68,5500,37,41,5389,6.351351351,Low,0,1,"Exterior of the car is quite aggressive and beautiful . Whereas , interior is very sophisticated and the build quality is average . Ac is the best part of this car and even work above 40 degrees centigrade . Large boot space , for traveling on longer routes . Fuel of this car is 16km/ l in city with ac and on long routes 18-20 . Brakes and handling is average . Pick-up is also good . The only bad thing about this car is it's hard suspension and it loses road grip above 120 km/h ",Positive
2,161,mitsubishi,std,two,hatchback,fwd,front,93.7,0.755886593,0.894444444,50.8,1944,ohc,four,92,2bbl,2.97,3.23,9.4,68,5500,31,38,6189,7.580645161,Low,0,1,"Pros: * Excellent ground clearance of 220 mm and an excellent submersion height of 60 mm make this car ideal for dealing with heavy rains and bad roads. * Excellent styling - looks like a smaller Fortuner. * Reasonable good tech - a very good Kenwood audio headset supporting CarPlay and Android Auto, automatic headlights, multiple power ports, great steering controls of audio headset. * 7 seater.  Cons * Lack of a 4th gear makes this car a horrible experience on the highway. The engine noise becomes very annoying once you start going above 100 km/hr. * The price in Pakistan is ridiculously high. Regionally, this car competes with Mitsubishi Expander and Honda BR-V where the price of all three is within a narrow range. In Pakistan, Toyota Rush is priced so extremely high which is, in my personal opinion, the SOLE reason for its failure in this market. Otherwise, it would have easily been far more successful than the BR-V if it had been priced closer to BR-V's price. More ",Positive
2,161,mitsubishi,std,two,hatchback,fwd,front,93.7,0.755886593,0.894444444,50.8,2004,ohc,four,92,2bbl,2.97,3.23,9.4,68,5500,31,38,6669,7.580645161,Low,0,1,"Really beautiful exterior better then city and ciaz Excellent fuel average excellent suspension best features - CSC,TC,Hill assist (these features are not provided in Any sedan in pakistan today) Additional : Airbags, ABS Drive is comfortable then corolla. value for money. ",Positive
1,161,mitsubishi,turbo,two,hatchback,fwd,front,93,0.755886593,0.886111111,50.8,2145,ohc,four,98,spdi,3.03,3.39,7.6,102,5500,24,30,7689,9.791666667,Medium,0,1,Very thing is good as we know this is 2005 model and this xar have more advanced fuction then todays civic fully automatic back shade and head rest dual climate control on back and front bothI am a imported lover but before this i bought civic 2013 model worst experience then i bought this in budget of 28 no compitition is tere,Neutral
3,153,mitsubishi,turbo,two,hatchback,fwd,front,96.3,0.831331091,0.908333333,49.4,2370,ohc,four,110,spdi,3.17,3.46,7.5,116,5500,23,30,9959,10.2173913,Medium,0,1,"Beautiful exterior, back lights & break lamp gives awsome look of back but its single headlights are not so good so its average from front. Many features like, airbags, traction control, cruise control, adjustable headlights, rear view camera, stereo system with bluetooth connectivity & much more Leatheroid Seats are very comfortable and give luxury feelings and good look of interior Cruise control buttons in steering wheel Good space for front passangers as well as for back passangers & back trunk space is also very large Fuel economy is good from its previous model, because its semi-hybrid car and gives almost 11-14 km/l local with ac and 15-17 km/l long with ac Ride quality is awsome, very less outer sound effect, good road grip, breaking system and handling Its very awsome car in this budget, luxury features are value to money, there's only one fault in this model that when car gets hot and you've fully loaded this car and climbing this car leaves the power More ",Positive
3,153,mitsubishi,std,two,hatchback,fwd,front,96.3,0.831331091,0.908333333,49.4,2328,ohc,four,122,2bbl,3.35,3.46,8.5,88,5000,25,32,8499,9.4,Low,0,1,"Exterior: Gives a rather aggressive look especially with daylights on.  Interior: Ok-ish. Although there's nothing wrong, but the blue and black tone is bit dull. I've got the sportage as well and KIA's red and black tone interior looks much better.  Safety: 2 airbags in a 5 million car range? Was expecting more.  Features: Electronic seats, huge android 'mercedes' type display unit, extended vision on turns in head lamps definitely outdoes it than any other car in this range of cars. oh, and a spare allow rim tire as well (y).  Ride Quality & Handling: It literally has the same engine as the KIA sportage, same outlook, even the same roar when you gas it up (great sport mode acceleration). Handling and road grip is definitely better than KIA for some unknown reason. None the less, it is definitely a great car to drive in the 5 Million PKR range.  Fuel Economy: Around 10 km/l. Again, Ok-ish.  Final Words: I would rate it just slightly better than KIA.  More ",Negative
