symboling,normalized-losses,make,aspiration,num-of-doors,body-style,drive-wheels,engine-location,wheel-base,length,width,height,curb-weight,engine-type,num-of-cylinders,engine-size,fuel-system,bore,stroke,compression-ratio,horsepower,peak-rpm,city-mpg,highway-mpg,price,city-L/100km,horsepower-binned,diesel,gas,Reviews,Sentiment
3,122,mitsubishi,turbo,two,hatchback,fwd,front,95.9,0.832292167,0.920833333,50.2,2833,ohc,four,156,spdi,3.58,3.86,7,145,5000,19,24,12629,12.36842105,Medium,0,1,Modern look power steering power window and much more future fuel average in 15 to 18 km Smooth drive comfortable seats led and digital speedometer after sales service good karachi prince motor staff very comparative and instantly resolve your issue in starting i have facing some problem they solve like gear shifting hard ,Negative
3,122,mitsubishi,turbo,two,hatchback,fwd,front,95.9,0.832292167,0.920833333,50.2,2921,ohc,four,156,spdi,3.59,3.86,7,145,5000,19,24,14869,12.36842105,Medium,0,1,awesome style simple beauty very very comfortable suspension and my all time favorite indus Corolla It's been seven years since I've had this car & I like it very much.... interior exterior very well diesel engine is better than petrol engine... fuel economy + performance + value for money....,Neutral
3,122,mitsubishi,turbo,two,hatchback,fwd,front,95.9,0.832292167,0.920833333,50.2,2926,ohc,four,156,spdi,3.59,3.86,7,145,5000,19,24,14489,12.36842105,Medium,0,1,pretty good experience outstanding vehicle ride and one of the best vehicle in AWD category in Pakistan but (diesel engine VS petrol engine) i think my little bit experience say diesel engine is better than petrol engine..... comfort + fuel economy + performance + value for money......etc. ,Negative
1,125,mitsubishi,std,four,sedan,fwd,front,96.3,0.828447862,0.908333333,51.6,2365,ohc,four,122,2bbl,3.35,3.46,8.5,88,5000,25,32,6989,9.4,Low,0,1,I also have Honda City auto 1.3 it's fuel average to bad in city drive slowly it's give you 7 to 8 and in long like highway it's give you 10 to 11 comfort level too bad you to tired while after drive exterior interior just ok the car and now price I must say don't buy this now when the price are reasonable around 20 lacs it's enough but now it's not ,Negative
1,125,mitsubishi,std,four,sedan,fwd,front,96.3,0.828447862,0.908333333,51.6,2405,ohc,four,122,2bbl,3.35,3.46,8.5,88,5000,25,32,8189,9.4,Low,0,1,"I have had this car for over a week now and i am certainly satisfied except for a few things. 1. Trunk space is too low, could have increased the size a bit. 2. back leg room is low is front seats are slid way back otherwise it is comfortable. 3. after driving for more than 400km the fuel average i got is 10-11 in city and 13-14 long with ac but have heard it is will increase after a few thousand km.  Overall, a great addition to market and way better than the shit product provided by suzuki (cultus, wagonr).",Neutral
1,125,mitsubishi,turbo,four,sedan,fwd,front,96.3,0.828447862,0.908333333,51.6,2403,ohc,four,110,spdi,3.17,3.46,7.5,116,5500,23,30,9279,10.2173913,Medium,0,1,i have a suzuki mehran 2006 model and it runs perfectly well even though after 14 years of running thus car is still running its acceleration is quite impressive if you press the accelerator a little harder it is also very cheap to maintain as its parts are easily avalible but because it is very old its fuel consumption has increased it only makes 9 to 10 km a litre but still its a grrat buy,Negative
-1,137,mitsubishi,std,four,sedan,fwd,front,96.3,0.828447862,0.908333333,51.6,2403,ohc,four,110,spdi,3.17,3.46,7.5,116,5500,23,30,9279,10.2173913,Medium,0,1,sports mode of driving just owsum very good interior ???? external look is best value for money sound system is also mind-blowing suspension is very good projector headlights are best each and every thing is in best design there is no match in this range to this car superb SUV. drive is just like big suvs. ,Negative
1,128,nissan,std,two,sedan,fwd,front,94.5,0.794329649,0.886111111,54.5,1889,ohc,four,97,2bbl,3.15,3.29,9.4,69,5200,31,37,5499,7.580645161,Low,0,1,"This variant had fog lamps, side skirts, door panels, paint matching door handle powered side mirrors and 5 spoke alloy rims.Interior had two tones, wooden style panels, Single Air bag, digital clock and arm rest and powered windows.This car was equiped with 1.8 VVT I engine with 140 hp at 6400 rpms which is good and has an economy of 9km/l in city and 14km/l on longSuspension is soft and comfortable.Negative is that this engine consumes engine oil",Negative
1,128,nissan,std,two,sedan,fwd,front,94.5,0.794329649,0.886111111,54.5,2017,ohc,four,103,idi,2.99,3.47,21.9,55,4800,45,50,7099,5.222222222,Low,1,0,All in one. Best car ever. Always recommended. Very comfortable very stylish. Value of money. Peace of mind. 8 air bags. Very spacious. Many Standard Active Safety Features. Good Front and Side Visibility. Responsive Steering. still holding onto one of the top spots for hybrid sales due to its emphasis on fuel efficiency.,Neutral
1,128,nissan,std,two,sedan,fwd,front,94.5,0.794329649,0.886111111,54.5,1918,ohc,four,97,2bbl,3.15,3.29,9.4,69,5200,31,37,6649,7.580645161,Low,0,1,"every thing is good but really disappointed by feul economy it's the king of All SUVS in Pakistan in range of 50 million to 60 millions , you should buy this instead of lx 570 or cruiser .............................................................................................................................. ",Negative
1,122,nissan,std,four,sedan,fwd,front,94.5,0.794329649,0.886111111,54.5,1938,ohc,four,97,2bbl,3.15,3.29,9.4,69,5200,31,37,6849,7.580645161,Low,0,1,"As far as the exterior styling is concerned the looks of the car are reasonably good, but I miss features like projector lamps and DRLs that come in some other 660 cars of the same year.  Interior looks average, but gets the job done nicely. AC is really good for a 660cc car The Seating capacity is for 4, with immense amount of leg space for front and back passengers. Quality of seats is good but you cannot comfortably take this car on long drives, as you will fatigue quickly bcoz the seat cushioning is very little.  The USP of this car is its Economy, I mostly drive on ring road and it gives around 23 km/L on AC with light foot.  Ride quality is above average, but it has a stiff suspension Handling is excellent, even on higher speeds it never feels that car is out of control even on sharp turns  Overall it is a good car for families to commute in city with excellent fuel economy and overall comfortable experience. More ",Negative
1,103,nissan,std,four,wagon,fwd,front,94.5,0.817876021,0.886111111,53.5,2024,ohc,four,97,2bbl,3.15,3.29,9.4,69,5200,31,37,7349,7.580645161,Low,0,1,Exrerior Average Interior also average Less room space only 2 person can sit on back seat back seat is comfortable as compare to front seats arm rest is at worst place Drive is not as good as toyota corolla suspenion is also average car is light weight ,Negative
1,128,nissan,std,two,sedan,fwd,front,94.5,0.794329649,0.886111111,54.5,1951,ohc,four,97,2bbl,3.15,3.29,9.4,69,5200,31,37,7299,7.580645161,Low,0,1,new Exterior like new than Zero condtuon full oower Ist owmer just buy and drive 1 hand use 35000 Km Drive chaska Party stay away plese and Full modeifed Exterior Leather saet fuel avg in City 7 and long 9     Origenl  ,Negative
1,128,nissan,std,two,hatchback,fwd,front,94.5,0.795771264,0.886111111,53.3,2028,ohc,four,97,2bbl,3.15,3.29,9.4,69,5200,31,37,7799,7.580645161,Low,0,1,best car in its league better than all the local competitors same as wagon r of this model fully loaded gives fuel average 15+ in city20+ on long route best in a budget of 12 lack fully loaded a satisfied user comfort is also very good any body who want fuel average buy this particular car,Neutral
1,122,nissan,std,four,sedan,fwd,front,94.5,0.794329649,0.886111111,54.5,1971,ohc,four,97,2bbl,3.15,3.29,9.4,69,5200,31,37,7499,7.580645161,Low,0,1,"Exterior design was so good and also very hard body I like it very much... The interior desion was very modern of its time , Its fully loaded variant which I have recently. The variant which I have is totally genuine in LUSHING condition. It s comfort level well not so well but also good . My variant is not underpowered ... It have amazing pick with fully powered of its engine.. I have my car in lushing condition totally... ",Negative
1,103,nissan,std,four,wagon,fwd,front,94.5,0.817876021,0.886111111,53.5,2037,ohc,four,97,2bbl,3.15,3.29,9.4,69,5200,31,37,7999,7.580645161,Low,0,1,"best car in the budget of 15 to16 lackhs value for money best for the person who does not care about fuel average every thing is good except fuel average performnce and comfort of this car is outstanding ,owned a rebirth before but reborn is better",Negative
2,168,nissan,std,two,hardtop,fwd,front,95.1,0.780394041,0.886111111,53.3,2008,ohc,four,97,2bbl,3.15,3.29,9.4,69,5200,31,37,8249,7.580645161,Low,0,1,"I have a Toyota corolla gli manual that is a pretty much good car. has a good fuel economy when drive with care, has a good a/c through and is more capable for a person who is looking for a family car. For me this is a brilliant car I love it's drive. I have also owned a Honda city as well but this car is much much better than the Honda city.",Neutral
0,106,nissan,std,four,hatchback,fwd,front,97.2,0.833253244,0.905555556,54.7,2324,ohc,four,120,2bbl,3.33,3.47,8.5,97,5200,27,34,8949,8.703703704,Low,0,1,"Suzuki Swift has very good interior but has total interior in plastic but we cannot expect any more from suzuki in Pakistan. Suzuki Swift Exterior is not much slim but looks like a flat car. It does not look any type of sporty car. From outside the car looks like it has a 660cc engine. In Interior, It does not have very much leg space and front room looks very bulky because of 1300cc engine. As far as the back room is concerned if the front seats are at medium position then their will be an sufficient space for people sitting in the back. The trunk is not too much spacious but it has reclining seats so if you want to load something you can easily recline the seats. I think that anyone should not buy applied for suzuki swift because of their price. You can get a very better used sedan in that price range. Buying Suzuki Swift for your daily driver is recommended but not on long drive. Thankyou. More ",Negative
0,106,nissan,std,four,sedan,fwd,front,97.2,0.833253244,0.905555556,54.7,2302,ohc,four,120,2bbl,3.33,3.47,8.5,97,5200,27,34,9549,8.703703704,Low,0,1,"pathetic fuel avg, lot of engine noise and vibration, streeing vibrtaion, airlock in fuel tank, gears are very hard, poor service at dealership, untrained staff at dealership, dashboard vibration. driven 3000 plus kilometers and experiencing really bad vibration from engine and dashboard as well. mechanics at dealership cannot resolve any of the problems as they dont know the solution because they are not trained.  overall really bad experience so far.",Negative
0,128,nissan,std,four,sedan,fwd,front,100.4,0.873137914,0.923611111,55.1,3095,ohcv,six,181,mpfi,3.43,3.27,9,152,5200,17,22,13499,13.82352941,Medium,0,1,exterior id awesome just backlights are not enough beautiful  FUEL AVERAGE IS ALSO GOOD 21 KM/ PER LITR  INTERIOR is SO beautiful  Wheels are not good some rickshaw tires are installed should make it better I impressed with paint and body quality ,Positive
0,108,nissan,std,four,wagon,fwd,front,100.4,0.887073522,0.923611111,56.1,3296,ohcv,six,181,mpfi,3.43,3.27,9,152,5200,17,22,14399,13.82352941,Medium,0,1,body shape is very good 660cc turbo engine can give good ride but fuel economy is not gud over all car material is also gud plus point is 4x4 mode from which car cannot stuck in mud and water overall car is very good but resale value is not gud.i have owned this car from around 3 months i realize that this car give me comfort like a luxury car but because of 660cc engine it cannot go on long route easily engine is 660cc but it gives more power as 1000cc car ,Positive
0,108,nissan,std,four,sedan,fwd,front,100.4,0.887073522,0.923611111,55.1,3060,ohcv,six,181,mpfi,3.43,3.27,9,152,5200,19,25,13499,12.36842105,Medium,0,1,"The exterior is fabulous and outstanding, the agressive head lights makes the car look elegant and respectable. The Sportage's front is trash ???? (no offence).  The interior is ""a ok"", do agree that Sportage's is better but no way is this worse than it, the 10.1 inch display makes the interior look better. Spaciousness wise both cars are the same.  I am a Civic owner and when the Tucson launched, I wanted to see if this car is really for me? The main reason I bought it was the space in the cabin that it provides and space is another luxury . If you're a sedan owner and have the budget to upgrade please do so, you would never ever regret your decision.  More ",Neutral
3,194,nissan,std,two,hatchback,rwd,front,91.3,0.820278712,0.943055556,49.7,3071,ohcv,six,181,mpfi,3.43,3.27,9,160,5200,19,25,17199,12.36842105,High,0,1,"exterior of this car is elegant . but the signature front grill is some what controversial. this is third generation of mercedes gls class this is considered a competitor of BMW X7. the multi beam LED headlamp system with total 112 LED bulbs per head lamp are fitted along with DRLs  also this car has many engine options e.g 3.0 and 4.0 litres and v8 engines . this car does not have split tail gate.the car has a 9 speed automatic 9G tronic gaear box. company calims it to be an S class of SUVs. overall, in my opinion the BMW X7 is better than this mercedes GLS  More ",Positive
3,194,nissan,turbo,two,hatchback,rwd,front,91.3,0.820278712,0.943055556,49.7,3139,ohcv,six,181,mpfi,3.43,3.27,7.8,200,5200,17,23,19699,13.82352941,High,0,1,"Completed 3 years and 40000km. Exterior is a personal choice. Front/rear fog lights and adjustable headlamps deserve a mention. Car is most comfortable and spacious in its league. Performance is outclass. Engine response, power, braking is perfect. I have driven it in all sorts of terrains. Car feels much stable and in control even at 160km/h. Maintenance cost is low, no big issue till now. Mileage is 12-13 in city, 16-18 on long, 14-14.5 at speeds above 120km/h. AC performance is good. Plastic parts tend to squeak with time. Safety features include 2 airbags, ABS, EBD, door crash beams, crumple zones, fireproof plastic, pretensioners. Resale is growing. Only problem is with cabin insulation. You do feel wind noise at high speeds plus general road noise at rough roads despite additional rubbers. Car is 100% value for money. Improved plastic quality, branded audio unit, larger fuel tank and good cabin insulation would be better More ",Positive
1,231,nissan,std,two,hatchback,rwd,front,99.2,0.857760692,0.943055556,49.7,3139,ohcv,six,181,mpfi,3.43,3.27,9,160,5200,19,25,18399,12.36842105,High,0,1,"This is the worst version of civic I had found, I am using civic since 1995, but this Civic 2018 is worst ....all body interior is mostly local production and claimed twice and not found B but... D class, on 15000KM I complain against steering then on 35,000 KM complaint about AC. I put the cruise on 130KM on M2 and while passing through Kallar Kahar it auto accelerate the engine to maintain 130KM/H and all sensors had down and the engine stopped working. I put this brand new car on truck and back to LHR from Kalar Kahhar where they just check up on the machine and reset all sensor so the car starts functional normally.  I have evidence if someone needs any information most welcome but this is not worth against you spending but the only Shape is WOW and nothing else.  Now I switched to Honda Vezzel 2015 and the excellent experience & decision I had made.  More ",Positive
0,161,peugot,std,four,sedan,rwd,front,107.9,0.897164825,0.95,56.7,3020,l,four,120,mpfi,3.46,3.19,8.4,97,5000,19,24,11900,12.36842105,Low,0,1,"Excellent car, I switched from Honda Civic 2018 and very afraid because I never have driven Japanese car but I found this is an excellent experience, I mean its pick is like WOW.... feel of Civic Turbo, the economy is excellent front sensors activate ABS this is an excellent feature. ",Neutral
0,161,peugot,turbo,four,sedan,rwd,front,107.9,0.897164825,0.95,56.7,3197,l,four,152,idi,3.7,3.52,21,95,4150,28,33,13200,8.392857143,Low,1,0,Beautiful exterior Best fuel average Best road grip Best features and this car is value for money Modern technology thousands time better then old GLI and XLI best car in this price range shape is excellent and modern engine performance is best excellent comfort level   ,Positive
0,122,peugot,std,four,wagon,rwd,front,114.2,0.955790485,0.95,58.7,3230,l,four,120,mpfi,3.46,3.19,8.4,97,5000,19,24,12440,12.36842105,Low,0,1,"In the year 2020 when even a small hatch back costs around 2 Million and car with basic features and bad build quality costs 4 Million... Honda Accord 2006 is best option for those who want best comfort in a limited budget The car is a Midsized Sedan which makes it stronger and more stable on long Journeys, the styling for a 2006 is contemporary and in a Pakistani Market it still has the road presence of a Luxury Vehicle People say it has a bad fuel economy, but never forget the fact that you cannot have Luxury and Economy in one package there is always a give away. Fuel wise 8 to 9kmpl on a 2400 cc car is amazing. Parts wise it takes Honda Civic Air and Oil Filter, Body parts are available from Dubai as this car was very common there. Last but not least, if you get a Honda Accord in Good Condition it is a no brainer as its the benchmark of reliability and comfort in budget. More ",Positive
0,122,peugot,turbo,four,wagon,rwd,front,114.2,0.955790485,0.95,58.7,3430,l,four,152,idi,3.7,3.52,21,95,4150,25,25,13860,9.4,Low,1,0,"I bought Suzuki Cultus zero meter in 2014 and till today I have driven it almost 83000 km. I have taken this car to Naran, Murree, Azad Kashmir (Neelum Valley) many times with 5 persons and luggage on board. This car provided excellent performance on hilly areas with full 5 persons on board along with luggage. Last month I travelled to Karachi by road with 4 persons in car and with continuos driving on motoray we reached karachi in 15 hours. That was also excellent experience. Despite of completing 82000 KM in odo, its performance was extra ordinary and it was going on 130km/hr easily on motorway but little struggling to reach 140km/hr speed. The features I am missing in this car is power windows, power steering, ABS breaks and central locking. Till now now I have changed rear suspensions of the car and all is genuine. i would recommend this car for small family. good and city and highway driving. More ",Positive
0,161,peugot,std,four,sedan,rwd,front,107.9,0.897164825,0.95,56.7,3075,l,four,120,mpfi,3.46,2.19,8.4,95,5000,19,24,15580,12.36842105,Low,0,1,Exterior is pearl white color  Interior consists of leather stitched glove box and wodden textured center console with aftermarket multimedia from japan.  fuel economy is 18 km/h in city but havent tested it in highway.  Has heated seats front passenger and driver with heated steering wheel.  Recently bought it from first owner and drives very well and is very well maintained as well. ,Neutral
0,161,peugot,turbo,four,sedan,rwd,front,107.9,0.897164825,0.95,56.7,3252,l,four,152,idi,3.7,3.52,21,95,4150,28,33,16900,8.392857143,Low,1,0,Exterior is at its best interior is awesome and comfort cannot pe compared Performance No comparision speed wow Handling is at its beast Only the true car lover can handle this beast Honda Civic is a faimly car and in adddition this car is also a performance car Honda civic cruise is the best It has a smooth and amazing start,Positive
0,122,peugot,std,four,wagon,rwd,front,114.2,0.955790485,0.95,56.7,3285,l,four,120,mpfi,3.46,2.19,8.4,95,5000,19,24,16695,12.36842105,Low,0,1,"I own Toyota Corolla altis 1.6. This Model of corolla has so much excellent features like abs brakes, alloy wheels, side skirts, android led, steering multimedia control, Imported tyres. Only the feature that I miss in my car is retractable mirror option. Otherwise This corolla altis automatic 1.6 is value for money.",Neutral
0,122,peugot,turbo,four,wagon,rwd,front,114.2,0.955790485,0.95,58.7,3485,l,four,152,idi,3.7,3.52,21,95,4150,25,25,17075,9.4,Low,1,0,"Classy exterior with a strong build quality. It has a good lengthy sports look. It's bumpers are not that good as they couldn't retain paint on them (Genuine bumpers are grey). Good spacious dashboard with time on it. Full spacious panel attached with dashboard. Very comforting seats. A lot of leg and head space. Best for height ed persons. Door panels are not that good. Drive of this car is the best in Pakistan. It's suspension is just like some off-road jeep. It is very powerful too. Comfort level is on top when you're driving a Daewoo. I would like to say that don't go for Mehran, Khyber, Margallah If you've a budget around 3-4 lac. Just go for a daewoo and you'll love it. Parts are easily available in Islamabad, Rawalpindi. Otherwise parts can be found in almost every city of Pakistan. More ",Positive
0,161,peugot,std,four,sedan,rwd,front,107.9,0.897164825,0.95,56.7,3075,l,four,120,mpfi,3.46,3.19,8.4,97,5000,19,24,16630,12.36842105,Low,0,1,Suzuki should improve Body Quality. Interior is nice with two tone colur and Full of features. Fuel Mileage is very exellent as compare to other cars. Handling is too good and smooth. I think Alto is best as compare to other 660cc cars and people should buy alto rather than other 660cc cars.,Positive
0,161,peugot,turbo,four,sedan,rwd,front,107.9,0.897164825,0.95,56.7,3252,l,four,152,idi,3.7,3.52,21,95,4150,28,33,17950,8.392857143,Low,1,0,"Exterior looks dashy and appealing. Alloy rims, side skirts and imported tyres add great value to the look of car. In this price, foglights and DRLs should have been pre-fitted. Plus smart entry is missing as well as push start button. Traction control is a basic thing that is missinh uptil now. Overall interior is spacious and comfortable. Engine power is optimal. Meter is really beautiful with steering controls. Back seat armrest plus two cupholders is a great plus. Colour contrast is appealing and eye-catchy! overall, an excellent car with compromises!!  More ",Neutral
0,161,peugot,turbo,four,sedan,rwd,front,108,0.897164825,0.948611111,56,3130,l,four,134,mpfi,3.61,3.21,7,142,5600,18,24,18150,13.05555556,Medium,0,1,"Exterior is much better than prev generation. Interior is also much beautiful comes with two-tone beautiful plastic dasboard, beautiful place for multimedia screen. Seats are also bit comfortable. This car have suspicious trunk, one can easily fit 3 master size bags. When we come to feul average I am much surprised in winters without ac it gives almost 15-16km/l in city, In summer with ac it gives 13.5-14.5 with ac. On highway it gives arround 17-18km/l. I usually drive with lighter foot. Ground clearance is good but when 4 people are sitting it's ain't enough. I've used it with 17'tyres it gave feul average arround 12-13 so i changed to 14' back. Overall in this price bracket (13-15lacs) there comes nothing. Vehicles like faw v2, bravo, pearl, alto don't have enough options for you like central locking, trunk space, better market value, abs, fog lights etc. So I'm happy with my purchase.  More ",Positive
1,119,plymouth,std,two,hatchback,fwd,front,93.7,0.755886593,0.886111111,50.8,1918,ohc,four,90,2bbl,2.97,3.23,9.4,68,5500,37,41,5572,6.351351351,Low,0,1,one of the best old cars used in pakistan. a good mileage car having hard body beautiful interior . it have 1200 cc 1.2 OHV engine .its a 4 door sedan car.the car i am having is karachi registered.this car have drum brakes and parking lamps also ,Neutral
1,119,plymouth,turbo,two,hatchback,fwd,front,93.7,0.755886593,0.886111111,50.8,2128,ohc,four,98,spdi,3.03,3.39,7.6,102,5500,24,30,7957,9.791666667,Medium,0,1,i have wagon r vxl 2017 model everything else is ok but iam not getting good fuel average it's 13 on long with a/c at the constant speed of 80 and 2.5 rpm and just 47000 droven i have recently replaced genuine air filter but not getting good response,Positive
1,154,plymouth,std,four,hatchback,fwd,front,93.7,0.755886593,0.886111111,50.6,1967,ohc,four,90,2bbl,2.97,3.23,9.4,68,5500,31,38,6229,7.580645161,Low,0,1,"Best car for people who have good height. the exterior of the car is really beautiful and the interior is also very good but at the back seat it has less space for sitting, cultus 1st generation was having more space for seating. my car has been driven for 70,000 km and the fuel economy is really good and engine is giving really good performance and a.c is also working good. ",Positive
1,154,plymouth,std,four,sedan,fwd,front,93.7,0.803940413,0.886111111,50.8,1989,ohc,four,90,2bbl,2.97,3.23,9.4,68,5500,31,38,6692,7.580645161,Low,0,1,"The exterior of car is basic and is one of the most well recieved shape of corolla . In terms of interior it comes up with optitron meter and one airbag in steering its driven 470,000 km on its own engine and gear and have recieved 2 times appreciation from toyota indus motor pakistan . Driving it from last 10 years and more to go . Fuel average is good if maintained properly 10-11 in city and 14 on highway at 120km/h it have some known faults of breaking engine mounts after every 15-25k kms some area of ac vents get uneven with time and some unknown faults are faulty maf sensor . Its maf is manually adjusted most of the people gets horrible economy out of it due to this . Auto choke sensor gets faulty after some time . Suspension and engine power is optimal . After market headunit and back cam installed along with some good speakers rest nothing is changed till now .  More ",Positive
